{
  "$schema": "https://doowon.local/docs/harness/schemas/domain-rule-manifest.schema.json",
  "domain_id": "shared-harness",
  "path_prefixes": [
    "docs/harness/",
    "docs/agents/",
    "docs/ops/",
    "CLAUDE.md",
    "agents.md",
    "apps/api/AGENTS.md",
    "apps/web/AGENTS.md",
    "apps/worker/AGENTS.md",
    "apps/ops/AGENTS.md",
    ".claude/commands/",
    ".claude/rules/",
    ".claude/hooks/",
    ".codex/skills/doowon-harness-engineering/"
  ],
  "responsibility": "시나리오 계약, eval, trace, release gate, adapter projection, helper selection 로직을 소유한다.",
  "scenario_candidates": [
    "documents-rag",
    "plm-query",
    "draft-generation",
    "ocr-pipeline",
    "pms"
  ],
  "must_read_docs": [
    "docs/agents/context-loading-policy.md",
    "docs/agents/agent-operating-standard.md",
    "docs/harness/harness-overview.md",
    "docs/harness/eval-regression-spec.md",
    "docs/harness/service-runtime-harness.md",
    "docs/harness/trace-and-scorecard-spec.md"
  ],
  "optional_support_docs": [
    "docs/ops/release-gates-and-alerts.md",
    "docs/architecture/system-blueprint.md"
  ],
  "do_not_load_by_default": [
    "legacy_ai_portal_prototype/CLAUDE.md"
  ],
  "local_rule_template": "docs/agents/local-rule-template.md"
}
