{
  "$schema": "https://doowon.local/docs/harness/schemas/domain-rule-manifest.schema.json",
  "domain_id": "documents",
  "path_prefixes": [
    "packages/api/documents/",
    "packages/api/search/",
    "packages/web/documents/",
    "packages/web/search/",
    "docs/harness/scenarios/documents-rag.md",
    "docs/harness/manifests/scenarios/documents-rag.json",
    "docs/harness/prompt-bundles/documents-rag/",
    ".claude/agents/rag-evaluator.md"
  ],
  "responsibility": "문서 검색, citation assembly, grounded answer, 검색 중심 UI 계약을 소유한다.",
  "scenario_candidates": [
    "documents-rag"
  ],
  "must_read_docs": [
    "docs/agents/context-loading-policy.md",
    "docs/agents/agent-operating-standard.md",
    "docs/agents/domain-context-mapping.md",
    "docs/harness/scenarios/documents-rag.md",
    "docs/harness/manifests/scenarios/documents-rag.json"
  ],
  "optional_support_docs": [
    "docs/harness/eval-regression-spec.md",
    "docs/harness/service-runtime-harness.md"
  ],
  "do_not_load_by_default": [
    "docs/harness/scenarios/plm-query.md",
    "docs/harness/scenarios/draft-generation.md",
    "docs/harness/scenarios/wiki-pms.md"
  ],
  "local_rule_template": "docs/agents/local-rule-template.md"
}
