{
  "$schema": "https://doowon.local/docs/harness/schemas/domain-rule-manifest.schema.json",
  "domain_id": "ocr",
  "path_prefixes": [
    "apps/api/src/aidoo_api/domains/ocr/",
    "apps/worker/src/aidoo_worker/tasks/ocr.py",
    "apps/ops/",
    "docs/harness/scenarios/ocr-pipeline.md",
    "docs/harness/manifests/scenarios/ocr-pipeline.json",
    "docs/harness/prompt-bundles/ocr-pipeline/"
  ],
  "responsibility": "OCR 필요 판정, 엔진 라우팅, 정규화 출력, 품질 judge 계약을 소유한다.",
  "scenario_candidates": [
    "ocr-pipeline"
  ],
  "must_read_docs": [
    "docs/agents/context-loading-policy.md",
    "docs/agents/agent-operating-standard.md",
    "docs/agents/domain-context-mapping.md",
    "docs/harness/scenarios/ocr-pipeline.md",
    "docs/harness/manifests/scenarios/ocr-pipeline.json"
  ],
  "optional_support_docs": [
    "docs/harness/eval-regression-spec.md",
    "docs/harness/service-runtime-harness.md"
  ],
  "do_not_load_by_default": [
    "docs/harness/scenarios/pms.md",
    "docs/harness/scenarios/plm-query.md"
  ],
  "local_rule_template": "docs/agents/local-rule-template.md"
}
